{
  "format": "triangle-terrain-windowed-v1",
  "max_source_pixels": 1000000000,
  "tile_rows": 256,
  "tile_cols": 256,
  "max_inflight_tiles": 1,
  "gdal_cache_mib": 64,
  "max_faces": 500000,
  "max_nodes": 2000000,
  "max_candidate_overlap_checks": 1000000000,
  "coverage_policy": "diagnostic_only",
  "minimum_valid_coverage": null,
  "coverage_policy_evidence_path": null,
  "coverage_policy_evidence_sha256": null,
  "source_vertical_unit_declaration": null,
  "source_vertical_unit_evidence_path": null,
  "source_vertical_unit_evidence_sha256": null,
  "source_vertical_datum_declaration": null,
  "source_vertical_datum_evidence_path": null,
  "source_vertical_datum_evidence_sha256": null,
  "area_abs_tolerance_m2": 1e-8,
  "area_rel_tolerance": 1e-10,
  "elevation_abs_tolerance_m": 1e-8,
  "elevation_rel_tolerance": 1e-10
}
